<?xml version="1.0" encoding="UTF-8"?>
<!-- generated: 2013-02-05T13:44:52-08:00 -->
<!-- generated by: vahi [??] -->
<sitecatalog xmlns="http://pegasus.isi.edu/schema/sitecatalog" xmlns:xsi="http://www.w3.org/2001/XMLSchema-instance" xsi:schemaLocation="http://pegasus.isi.edu/schema/sitecatalog http://pegasus.isi.edu/schema/sc-4.0.xsd" version="4.0">
<site  handle="local" arch="x86" os="LINUX" osrelease="" osversion="" glibc="">
	<directory  path="/test/junit/output/mapper/blackdiamond/work" type="shared-scratch" free-size="" total-size="">
		<file-server  operation="all" url="file:///test/junit/output/mapper/blackdiamond/work">
		</file-server>
	</directory>

	<directory  path="/test/junit/output/mapper/blackdiamond/outputs" type="shared-storage" free-size="" total-size="">
		<file-server  operation="put"
			      url="file:///test/junit/output/mapper/blackdiamond/outputs"/>
		<file-server  operation="get"
			      url="gsiftp://sukhna.isi.edu/test/junit/output/mapper/blackdiamond/outputs"/>
		<!--<file-server  operation="get" url="gsiftp://corbusier.isi.edu/test/junit/output/mapper/blackdiamond/outputs"/>-->

	</directory>

	<profile namespace="pegasus" key="clusters.num" >1</profile>
</site>
<site  handle="blueridge" arch="x86" os="LINUX" osrelease="" osversion="" glibc="">
	<grid  type="batch" contact="vahi@br0.renci.org" scheduler="PBS" jobtype="compute" os="LINUX" arch="x86"/>
	<grid  type="batch" contact="vahi@br0.renci.org" scheduler="PBS" jobtype="auxillary" os="LINUX" arch="x86"/>
	<directory  path="/home/vahi/shared-scratch" type="shared-scratch" free-size="" total-size="">
		<file-server  operation="all" url="file:///home/vahi/shared-scratch">
		</file-server>
	</directory>

	<profile namespace="env" key="PEGASUS_HOME" >/usr</profile>
	<profile namespace="pegasus" key="style" >ssh</profile>

        <profile namespace="pegasus" key="change.dir" >true</profile>


	<!-- some globus and condor profile keys that get translated
	    to remote_ce_requirements -->
	<profile namespace="globus" key="queue">quick</profile>
	<profile namespace="globus" key="hostcount">5</profile>
	<profile namespace="globus" key="count">4</profile>
	<profile namespace="globus" key="maxwalltime">30</profile>
	<profile namespace="condor" key="priority">2</profile>
</site>
<site  handle="condorpool" arch="x86" os="LINUX" osrelease="" osversion="" glibc="">
	<profile namespace="condor" key="universe" >vanilla</profile>
	<profile namespace="pegasus" key="style" >condor</profile>
</site>
</sitecatalog>
